{
  "$schema": "http://json-schema.org/draft-07/schema#",
  "$id": "https://raw.githubusercontent.com/Next-Tablet-Driver/NextTabletDriver/master/docs/themes/theme.schema.json",
  "title": "NextTabletDriver theme",
  "description": "A user theme: overrides of the design tokens listed under `tokens`.",
  "type": "object",
  "required": [
    "schema",
    "metadata",
    "tokens"
  ],
  "properties": {
    "$schema": {
      "type": "string",
      "description": "Optional: this schema's URL, for editor support."
    },
    "schema": {
      "const": 1,
      "description": "Theme file format version."
    },
    "metadata": {
      "type": "object",
      "required": [
        "name"
      ],
      "additionalProperties": false,
      "properties": {
        "name": {
          "type": "string",
          "description": "Name shown in Settings > Themes.",
          "maxLength": 200,
          "minLength": 1
        },
        "author": {
          "type": "string",
          "description": "Your name or alias.",
          "maxLength": 200
        },
        "version": {
          "type": "string",
          "description": "Theme version, e.g. `1.0`.",
          "maxLength": 200
        },
        "description": {
          "type": "string",
          "description": "One line about the theme.",
          "maxLength": 200
        }
      }
    },
    "base": {
      "enum": [
        "dark",
        "light"
      ],
      "default": "dark",
      "description": "Built-in theme that every token you do not set falls back to."
    },
    "tokens": {
      "type": "object",
      "description": "Token overrides. Names are the CSS variable names without the leading `--`.",
      "additionalProperties": false,
      "maxProperties": 200,
      "properties": {
        "bg-app": {
          "type": "string",
          "description": "Window background. A color: #rgb, #rrggbb, #rrggbbaa, rgb()/rgba()/hsl()/hsla() or transparent.",
          "pattern": "^(?:transparent|#(?:[0-9a-fA-F]{3,4}|[0-9a-fA-F]{6}|[0-9a-fA-F]{8})|(?:rgb|rgba|hsl|hsla)\\([0-9., %/degDEG]+\\))$",
          "maxLength": 200
        },
        "bg-panel": {
          "type": "string",
          "description": "Cards, groups, menus and panels. A color: #rgb, #rrggbb, #rrggbbaa, rgb()/rgba()/hsl()/hsla() or transparent.",
          "pattern": "^(?:transparent|#(?:[0-9a-fA-F]{3,4}|[0-9a-fA-F]{6}|[0-9a-fA-F]{8})|(?:rgb|rgba|hsl|hsla)\\([0-9., %/degDEG]+\\))$",
          "maxLength": 200
        },
        "bg-panel-hover": {
          "type": "string",
          "description": "Panels and menu items under the pointer. A color: #rgb, #rrggbb, #rrggbbaa, rgb()/rgba()/hsl()/hsla() or transparent.",
          "pattern": "^(?:transparent|#(?:[0-9a-fA-F]{3,4}|[0-9a-fA-F]{6}|[0-9a-fA-F]{8})|(?:rgb|rgba|hsl|hsla)\\([0-9., %/degDEG]+\\))$",
          "maxLength": 200
        },
        "bg-input": {
          "type": "string",
          "description": "Background of inputs and dropdown triggers. A color: #rgb, #rrggbb, #rrggbbaa, rgb()/rgba()/hsl()/hsla() or transparent.",
          "pattern": "^(?:transparent|#(?:[0-9a-fA-F]{3,4}|[0-9a-fA-F]{6}|[0-9a-fA-F]{8})|(?:rgb|rgba|hsl|hsla)\\([0-9., %/degDEG]+\\))$",
          "maxLength": 200
        },
        "bg-tab-active": {
          "type": "string",
          "description": "Background of the active tab. A color: #rgb, #rrggbb, #rrggbbaa, rgb()/rgba()/hsl()/hsla() or transparent.",
          "pattern": "^(?:transparent|#(?:[0-9a-fA-F]{3,4}|[0-9a-fA-F]{6}|[0-9a-fA-F]{8})|(?:rgb|rgba|hsl|hsla)\\([0-9., %/degDEG]+\\))$",
          "maxLength": 200
        },
        "text-main": {
          "type": "string",
          "description": "Normal text. A color: #rgb, #rrggbb, #rrggbbaa, rgb()/rgba()/hsl()/hsla() or transparent.",
          "pattern": "^(?:transparent|#(?:[0-9a-fA-F]{3,4}|[0-9a-fA-F]{6}|[0-9a-fA-F]{8})|(?:rgb|rgba|hsl|hsla)\\([0-9., %/degDEG]+\\))$",
          "maxLength": 200
        },
        "text-muted": {
          "type": "string",
          "description": "Secondary text, hints and icons. A color: #rgb, #rrggbb, #rrggbbaa, rgb()/rgba()/hsl()/hsla() or transparent.",
          "pattern": "^(?:transparent|#(?:[0-9a-fA-F]{3,4}|[0-9a-fA-F]{6}|[0-9a-fA-F]{8})|(?:rgb|rgba|hsl|hsla)\\([0-9., %/degDEG]+\\))$",
          "maxLength": 200
        },
        "text-active": {
          "type": "string",
          "description": "Titles and hovered text. A color: #rgb, #rrggbb, #rrggbbaa, rgb()/rgba()/hsl()/hsla() or transparent.",
          "pattern": "^(?:transparent|#(?:[0-9a-fA-F]{3,4}|[0-9a-fA-F]{6}|[0-9a-fA-F]{8})|(?:rgb|rgba|hsl|hsla)\\([0-9., %/degDEG]+\\))$",
          "maxLength": 200
        },
        "text-strong": {
          "type": "string",
          "description": "Names and headings one step above normal text. A color: #rgb, #rrggbb, #rrggbbaa, rgb()/rgba()/hsl()/hsla() or transparent.",
          "pattern": "^(?:transparent|#(?:[0-9a-fA-F]{3,4}|[0-9a-fA-F]{6}|[0-9a-fA-F]{8})|(?:rgb|rgba|hsl|hsla)\\([0-9., %/degDEG]+\\))$",
          "maxLength": 200
        },
        "text-emphasis": {
          "type": "string",
          "description": "The strongest text (statistics, highlighted names). A color: #rgb, #rrggbb, #rrggbbaa, rgb()/rgba()/hsl()/hsla() or transparent.",
          "pattern": "^(?:transparent|#(?:[0-9a-fA-F]{3,4}|[0-9a-fA-F]{6}|[0-9a-fA-F]{8})|(?:rgb|rgba|hsl|hsla)\\([0-9., %/degDEG]+\\))$",
          "maxLength": 200
        },
        "text-on-accent": {
          "type": "string",
          "description": "Text drawn on an accent-colored background. A color: #rgb, #rrggbb, #rrggbbaa, rgb()/rgba()/hsl()/hsla() or transparent.",
          "pattern": "^(?:transparent|#(?:[0-9a-fA-F]{3,4}|[0-9a-fA-F]{6}|[0-9a-fA-F]{8})|(?:rgb|rgba|hsl|hsla)\\([0-9., %/degDEG]+\\))$",
          "maxLength": 200
        },
        "text-number": {
          "type": "string",
          "description": "Numeric values in inputs. A color: #rgb, #rrggbb, #rrggbbaa, rgb()/rgba()/hsl()/hsla() or transparent.",
          "pattern": "^(?:transparent|#(?:[0-9a-fA-F]{3,4}|[0-9a-fA-F]{6}|[0-9a-fA-F]{8})|(?:rgb|rgba|hsl|hsla)\\([0-9., %/degDEG]+\\))$",
          "maxLength": 200
        },
        "accent": {
          "type": "string",
          "description": "Main theme color: selections, checkboxes, active widgets. A color: #rgb, #rrggbb, #rrggbbaa, rgb()/rgba()/hsl()/hsla() or transparent.",
          "pattern": "^(?:transparent|#(?:[0-9a-fA-F]{3,4}|[0-9a-fA-F]{6}|[0-9a-fA-F]{8})|(?:rgb|rgba|hsl|hsla)\\([0-9., %/degDEG]+\\))$",
          "maxLength": 200
        },
        "accent-hover": {
          "type": "string",
          "description": "Accent while hovered. A color: #rgb, #rrggbb, #rrggbbaa, rgb()/rgba()/hsl()/hsla() or transparent.",
          "pattern": "^(?:transparent|#(?:[0-9a-fA-F]{3,4}|[0-9a-fA-F]{6}|[0-9a-fA-F]{8})|(?:rgb|rgba|hsl|hsla)\\([0-9., %/degDEG]+\\))$",
          "maxLength": 200
        },
        "border": {
          "type": "string",
          "description": "Borders between cards and panels. A color: #rgb, #rrggbb, #rrggbbaa, rgb()/rgba()/hsl()/hsla() or transparent.",
          "pattern": "^(?:transparent|#(?:[0-9a-fA-F]{3,4}|[0-9a-fA-F]{6}|[0-9a-fA-F]{8})|(?:rgb|rgba|hsl|hsla)\\([0-9., %/degDEG]+\\))$",
          "maxLength": 200
        },
        "border-hover": {
          "type": "string",
          "description": "Borders of interactive cards while hovered. A color: #rgb, #rrggbb, #rrggbbaa, rgb()/rgba()/hsl()/hsla() or transparent.",
          "pattern": "^(?:transparent|#(?:[0-9a-fA-F]{3,4}|[0-9a-fA-F]{6}|[0-9a-fA-F]{8})|(?:rgb|rgba|hsl|hsla)\\([0-9., %/degDEG]+\\))$",
          "maxLength": 200
        },
        "info": {
          "type": "string",
          "description": "Informational status. A color: #rgb, #rrggbb, #rrggbbaa, rgb()/rgba()/hsl()/hsla() or transparent.",
          "pattern": "^(?:transparent|#(?:[0-9a-fA-F]{3,4}|[0-9a-fA-F]{6}|[0-9a-fA-F]{8})|(?:rgb|rgba|hsl|hsla)\\([0-9., %/degDEG]+\\))$",
          "maxLength": 200
        },
        "warning": {
          "type": "string",
          "description": "Warning status. A color: #rgb, #rrggbb, #rrggbbaa, rgb()/rgba()/hsl()/hsla() or transparent.",
          "pattern": "^(?:transparent|#(?:[0-9a-fA-F]{3,4}|[0-9a-fA-F]{6}|[0-9a-fA-F]{8})|(?:rgb|rgba|hsl|hsla)\\([0-9., %/degDEG]+\\))$",
          "maxLength": 200
        },
        "error": {
          "type": "string",
          "description": "Error status (log levels, validation). A color: #rgb, #rrggbb, #rrggbbaa, rgb()/rgba()/hsl()/hsla() or transparent.",
          "pattern": "^(?:transparent|#(?:[0-9a-fA-F]{3,4}|[0-9a-fA-F]{6}|[0-9a-fA-F]{8})|(?:rgb|rgba|hsl|hsla)\\([0-9., %/degDEG]+\\))$",
          "maxLength": 200
        },
        "danger": {
          "type": "string",
          "description": "Destructive actions. A color: #rgb, #rrggbb, #rrggbbaa, rgb()/rgba()/hsl()/hsla() or transparent.",
          "pattern": "^(?:transparent|#(?:[0-9a-fA-F]{3,4}|[0-9a-fA-F]{6}|[0-9a-fA-F]{8})|(?:rgb|rgba|hsl|hsla)\\([0-9., %/degDEG]+\\))$",
          "maxLength": 200
        },
        "danger-hover": {
          "type": "string",
          "description": "Destructive actions while hovered. A color: #rgb, #rrggbb, #rrggbbaa, rgb()/rgba()/hsl()/hsla() or transparent.",
          "pattern": "^(?:transparent|#(?:[0-9a-fA-F]{3,4}|[0-9a-fA-F]{6}|[0-9a-fA-F]{8})|(?:rgb|rgba|hsl|hsla)\\([0-9., %/degDEG]+\\))$",
          "maxLength": 200
        },
        "success": {
          "type": "string",
          "description": "Success / running status. A color: #rgb, #rrggbb, #rrggbbaa, rgb()/rgba()/hsl()/hsla() or transparent.",
          "pattern": "^(?:transparent|#(?:[0-9a-fA-F]{3,4}|[0-9a-fA-F]{6}|[0-9a-fA-F]{8})|(?:rgb|rgba|hsl|hsla)\\([0-9., %/degDEG]+\\))$",
          "maxLength": 200
        },
        "debug": {
          "type": "string",
          "description": "Debug-level log lines. A color: #rgb, #rrggbb, #rrggbbaa, rgb()/rgba()/hsl()/hsla() or transparent.",
          "pattern": "^(?:transparent|#(?:[0-9a-fA-F]{3,4}|[0-9a-fA-F]{6}|[0-9a-fA-F]{8})|(?:rgb|rgba|hsl|hsla)\\([0-9., %/degDEG]+\\))$",
          "maxLength": 200
        },
        "overlay-rgb": {
          "type": "string",
          "description": "Channels of the color used for translucent highlights (white on dark themes, black on light themes). Three channels from 0 to 255 separated by spaces, e.g. `255 255 255`.",
          "pattern": "^[0-9]{1,3} [0-9]{1,3} [0-9]{1,3}$",
          "maxLength": 200
        },
        "shade-rgb": {
          "type": "string",
          "description": "Channels of the color used for translucent shadows and darkening. Three channels from 0 to 255 separated by spaces, e.g. `255 255 255`.",
          "pattern": "^[0-9]{1,3} [0-9]{1,3} [0-9]{1,3}$",
          "maxLength": 200
        },
        "input-bg": {
          "type": "string",
          "description": "Input field background. A color: #rgb, #rrggbb, #rrggbbaa, rgb()/rgba()/hsl()/hsla() or transparent.",
          "pattern": "^(?:transparent|#(?:[0-9a-fA-F]{3,4}|[0-9a-fA-F]{6}|[0-9a-fA-F]{8})|(?:rgb|rgba|hsl|hsla)\\([0-9., %/degDEG]+\\))$",
          "maxLength": 200
        },
        "input-bg-hover": {
          "type": "string",
          "description": "Input field background while hovered. A color: #rgb, #rrggbb, #rrggbbaa, rgb()/rgba()/hsl()/hsla() or transparent.",
          "pattern": "^(?:transparent|#(?:[0-9a-fA-F]{3,4}|[0-9a-fA-F]{6}|[0-9a-fA-F]{8})|(?:rgb|rgba|hsl|hsla)\\([0-9., %/degDEG]+\\))$",
          "maxLength": 200
        },
        "input-bg-focus": {
          "type": "string",
          "description": "Input field background while focused. A color: #rgb, #rrggbb, #rrggbbaa, rgb()/rgba()/hsl()/hsla() or transparent.",
          "pattern": "^(?:transparent|#(?:[0-9a-fA-F]{3,4}|[0-9a-fA-F]{6}|[0-9a-fA-F]{8})|(?:rgb|rgba|hsl|hsla)\\([0-9., %/degDEG]+\\))$",
          "maxLength": 200
        },
        "input-border": {
          "type": "string",
          "description": "Input field border. A color: #rgb, #rrggbb, #rrggbbaa, rgb()/rgba()/hsl()/hsla() or transparent.",
          "pattern": "^(?:transparent|#(?:[0-9a-fA-F]{3,4}|[0-9a-fA-F]{6}|[0-9a-fA-F]{8})|(?:rgb|rgba|hsl|hsla)\\([0-9., %/degDEG]+\\))$",
          "maxLength": 200
        },
        "input-border-hover": {
          "type": "string",
          "description": "Input field border while hovered. A color: #rgb, #rrggbb, #rrggbbaa, rgb()/rgba()/hsl()/hsla() or transparent.",
          "pattern": "^(?:transparent|#(?:[0-9a-fA-F]{3,4}|[0-9a-fA-F]{6}|[0-9a-fA-F]{8})|(?:rgb|rgba|hsl|hsla)\\([0-9., %/degDEG]+\\))$",
          "maxLength": 200
        },
        "area-display": {
          "type": "string",
          "description": "Display area in the output preview. A color: #rgb, #rrggbb, #rrggbbaa, rgb()/rgba()/hsl()/hsla() or transparent.",
          "pattern": "^(?:transparent|#(?:[0-9a-fA-F]{3,4}|[0-9a-fA-F]{6}|[0-9a-fA-F]{8})|(?:rgb|rgba|hsl|hsla)\\([0-9., %/degDEG]+\\))$",
          "maxLength": 200
        },
        "area-tablet": {
          "type": "string",
          "description": "Tablet area in the output preview. A color: #rgb, #rrggbb, #rrggbbaa, rgb()/rgba()/hsl()/hsla() or transparent.",
          "pattern": "^(?:transparent|#(?:[0-9a-fA-F]{3,4}|[0-9a-fA-F]{6}|[0-9a-fA-F]{8})|(?:rgb|rgba|hsl|hsla)\\([0-9., %/degDEG]+\\))$",
          "maxLength": 200
        },
        "area-border-main": {
          "type": "string",
          "description": "Outline of the tablet area. A color: #rgb, #rrggbb, #rrggbbaa, rgb()/rgba()/hsl()/hsla() or transparent.",
          "pattern": "^(?:transparent|#(?:[0-9a-fA-F]{3,4}|[0-9a-fA-F]{6}|[0-9a-fA-F]{8})|(?:rgb|rgba|hsl|hsla)\\([0-9., %/degDEG]+\\))$",
          "maxLength": 200
        },
        "area-border-pink": {
          "type": "string",
          "description": "Outline of the osu! playfield. A color: #rgb, #rrggbb, #rrggbbaa, rgb()/rgba()/hsl()/hsla() or transparent.",
          "pattern": "^(?:transparent|#(?:[0-9a-fA-F]{3,4}|[0-9a-fA-F]{6}|[0-9a-fA-F]{8})|(?:rgb|rgba|hsl|hsla)\\([0-9., %/degDEG]+\\))$",
          "maxLength": 200
        },
        "area-playfield": {
          "type": "string",
          "description": "Fill of the osu! playfield rectangle. A color: #rgb, #rrggbb, #rrggbbaa, rgb()/rgba()/hsl()/hsla() or transparent.",
          "pattern": "^(?:transparent|#(?:[0-9a-fA-F]{3,4}|[0-9a-fA-F]{6}|[0-9a-fA-F]{8})|(?:rgb|rgba|hsl|hsla)\\([0-9., %/degDEG]+\\))$",
          "maxLength": 200
        },
        "area-contrast": {
          "type": "string",
          "description": "Text and handles drawn over the preview areas. A color: #rgb, #rrggbb, #rrggbbaa, rgb()/rgba()/hsl()/hsla() or transparent.",
          "pattern": "^(?:transparent|#(?:[0-9a-fA-F]{3,4}|[0-9a-fA-F]{6}|[0-9a-fA-F]{8})|(?:rgb|rgba|hsl|hsla)\\([0-9., %/degDEG]+\\))$",
          "maxLength": 200
        },
        "console-text": {
          "type": "string",
          "description": "Log message text. A color: #rgb, #rrggbb, #rrggbbaa, rgb()/rgba()/hsl()/hsla() or transparent.",
          "pattern": "^(?:transparent|#(?:[0-9a-fA-F]{3,4}|[0-9a-fA-F]{6}|[0-9a-fA-F]{8})|(?:rgb|rgba|hsl|hsla)\\([0-9., %/degDEG]+\\))$",
          "maxLength": 200
        },
        "titlebar-close-bg": {
          "type": "string",
          "description": "Close button background while hovered. A color: #rgb, #rrggbb, #rrggbbaa, rgb()/rgba()/hsl()/hsla() or transparent.",
          "pattern": "^(?:transparent|#(?:[0-9a-fA-F]{3,4}|[0-9a-fA-F]{6}|[0-9a-fA-F]{8})|(?:rgb|rgba|hsl|hsla)\\([0-9., %/degDEG]+\\))$",
          "maxLength": 200
        },
        "titlebar-close-fg": {
          "type": "string",
          "description": "Close button icon while hovered. A color: #rgb, #rrggbb, #rrggbbaa, rgb()/rgba()/hsl()/hsla() or transparent.",
          "pattern": "^(?:transparent|#(?:[0-9a-fA-F]{3,4}|[0-9a-fA-F]{6}|[0-9a-fA-F]{8})|(?:rgb|rgba|hsl|hsla)\\([0-9., %/degDEG]+\\))$",
          "maxLength": 200
        },
        "radius-sm": {
          "type": "string",
          "description": "Smallest corner radius. A length in px, rem or em. At most 32px.",
          "pattern": "^[0-9]+(?:\\.[0-9]+)?(?:px|rem|em)$",
          "maxLength": 200
        },
        "radius-md": {
          "type": "string",
          "description": "Default corner radius (buttons, inputs). A length in px, rem or em. At most 32px.",
          "pattern": "^[0-9]+(?:\\.[0-9]+)?(?:px|rem|em)$",
          "maxLength": 200
        },
        "radius-lg": {
          "type": "string",
          "description": "Large corner radius (panels, menus). A length in px, rem or em. At most 32px.",
          "pattern": "^[0-9]+(?:\\.[0-9]+)?(?:px|rem|em)$",
          "maxLength": 200
        },
        "radius-xl": {
          "type": "string",
          "description": "Extra large corner radius (cards). A length in px, rem or em. At most 32px.",
          "pattern": "^[0-9]+(?:\\.[0-9]+)?(?:px|rem|em)$",
          "maxLength": 200
        },
        "disabled-opacity": {
          "type": "string",
          "description": "Opacity of disabled controls (0 to 1). A number. Between 0 and 1.",
          "pattern": "^[0-9]+(?:\\.[0-9]+)?$",
          "maxLength": 200
        },
        "font-sans": {
          "type": "string",
          "description": "Interface font stack. Only installed fonts can be used. A comma-separated list of installed font names.",
          "pattern": "^[A-Za-z0-9 ,'\"._-]+$",
          "maxLength": 200
        },
        "font-mono": {
          "type": "string",
          "description": "Monospace font stack (console, hashes). A comma-separated list of installed font names.",
          "pattern": "^[A-Za-z0-9 ,'\"._-]+$",
          "maxLength": 200
        }
      }
    }
  }
}
